"اگر شخصی به کسی که مشغول نماز باشد، سلام کند باید ""همان طور"" که او سلام کرده فوراً جواب دهد.",اگر در حال نماز باشیم و شخصی وارد شود و خطاب به ما سلام کند، باید در جوابش فقط بگوییم «علیکم السلام».,c
خَلَف بن اَحمَد (خلف بن ابو جعفر بن لیث) ملقب به امیر خلف بانو، آخرین امیر صفاری بود که بر سیستان حکم راند. در زمان او ، و به دستورش، تفسیری بزرگ شامل صد جلد برای قرآن نوشته شد. دوران فرمانروایی این واپسین امیر صفاری که خلیفه به او لقب ولی الدوله داده بود حدود چهل سال به طول انجامید.,خلیفه به امیر طاهر صفاری لقب ولی الدوله را داد و به دستور امیر طاهر که ملقب به امیرخلف بانو بود تفسیری صد جلدی بر قرآن نوشته شد. ,c
ستون فقرات ارتش جدید (پس از فروپاشی ارتش صدام حسین) را نیروی زمینی تشکیل می‌دهد که ۱۹۳ هزار افسر و سرباز را دربرمی‌گیرد.,نیروی دریایی ستون فقرات ارتش عراق است.,c
یکی از مهم‌ترین فرهنگ‌هایی که در دوران دفاع مقدس در افکار مردم رایج شد جنگیدن رزمندگان اسلام برای ادای تکلیف الهی بود و آن‌ها نتیجه را فرع بر انجام تکلیف می‌دانستند.,« دریافت نتیجه فرع بر تلاش» از مهمترین فرهنگ‌های دوران دفاع مقدس بود که در اذهان مردم افتاده بود. ,c
به هر گونه کوشش در راه خدا و تلاش براى انجام نیکی ها و مبارزه با هوسهاى سرکش، مبارزه و جهاد اکبر و به پیکار با دشمنان ظالم و ستمگر، مبارزه و جهاد اصغر گفته می شود که فریاد آزادی اجتماعی پیامبران در سایه هر دوی آنهاست.,پیغمبران در پرتو علم و دانش، آزادی اجتماعی را فریاد زدند.,c
به هنگام هجوم غافلگیرانه دشمن به ٨٠٠ کیلومتر از مرزهای جنوب و غرب، ضرورت ایجاد سازماندهی و تشکیلات قوی نظامی و مردمی متناسب با ویژگی‌های انقلاب اسلامی مشخص شد.,دشمن از مرزهای جنوب و غرب کشور هجوم آوردند و حدود ۱۰۰۰ کیلومتر پیشروی کردند. ,c
در میان گزارش‌های بازمانده از یورش افغانان و سقوط اصفهان، روایت جهانگرد (سیاح) لهستانی یوداش تادوش کروسینسکی راهب یسوعی، که در زمان یورش از مبلغان مسیحی مقیم اصفهان بود، از اهمیت ویژه‌ای برخوردار است.,تنها جهانگردی که در زمان یورش افغان ها در اصفهان بود، شاردن بود.,c
روز بزرگداشت سهروردی، به تأیید مرکز تقویم مؤسسهٔ ژئوفیزیک دانشگاه تهران، ۸ مرداد هر سال برابر با ۲۹ ژوئیه است که در این روز همایش‌ها، بزرگداشت‌ها و یادبودهایی برای او برگزار می‌شود.,۷ دی، روز بزرگداشت سهروردی می باشد.,c
صفات سلبیه صفاتی هستند که ذات خداوند از آنها منزه است. این صفات هر کدام به نوعی موجب نقص و کمبود هستند و چون در ذات خداوند هیچ گونه نقصی راه ندارد،صفاتی مانند پیری،ظلم، ماده بودن هم در او راه ندارد.,صفاتی چون پیری،ظلم، ماده بودن به خداوند راه ندارد، چون خداوند صفات ثبوتیه را ندارد و از آن مبراست.,c
نعیم حداد جنگ بین ایران و عراق را دو ماه پیش از حمله سراسری جریان یافته تلقی کرده و از میانجیگری و مذاکره سخن می گوید. امّا این بهانه ها نتوانست توجیهی برای آغاز حمله سراسری باشد. از این رو پس از مشورت با دوستان و اربابان خارجی، دولت عراق بهترین بهانه برای شروع حمله را ابطال قرارداد الجزایر دانست. ,بهترین دستاویز عراق برای شروع هجوم سراسری به ایران ، استرداد جزایر سه‌گانه بود. ,c
هنگامی که انسان بیدار است، به این دلیل که روح انسان می‌بایست به تدبیر کامل جسم بپردازد و اکثراً به آن تعلق داشته باشد، نمی‌تواند در عالم معنا سیر کند.,دلیل قادر نبودن روح انسان به حرکت در عالم معنا در بیداری این است که روح، مغلوب عالم ماده و محبوس زمان است.,c
اگر بشر دنبال فلسفه رفته است برای همین حس بوده است‏ که حقیقت و حقایق اشیاء را درک کند.,جز در نتیجه حس درک نیکی در انسان، فلسفه به وجود نیامده است.,c
بهاءالدین خرمشاهی، نویسنده، مترجم، روزنامه‌نگار، طنزپرداز، فرهنگ‌نویس، حافظ پژوه، شاعر و استاد دانشگاه ایرانی است. وی تألیفاتی در حافظ‌شناسی و تفسیر اشعار او دارد.پژوهش در شعر و زندگی حافظ شیرازی حوزهٔ تخصصی کار پژوهشی خرمشاهی است.,تفسیر قرآن، تخصص اصلی بهاءالدین خرمشاهی در کارهای پژوهشی می باشد.,c
پس از پیروزی انقلاب، ارتش در حساسترین شرایط حیات خود قرار گرفته بود، امام خمینی (ره) طی پیامی ، ضرورت حفظ ارتش را اعلام و در جهت انسجام، یکپارچگی و وحدت ارتش، فرمان تاریخی و مهمی را صادر فرمودند و روز ۲۹ فروردین را روز ارتش نامگذاری کردند,به منظور جلوگیری از انحلال ارتش و حفظ آن، روز ۲۹ اردیبهشت روز ارتش نام گرفت.,c
کَلیله و دِمنه کتابی است از اصل هندی که در دوران ساسانی به فارسی میانه ترجمه شد.,"کتاب ""کلیله و دمنه"" در اصل به زبان روسی بوده است.",c
جنگ‌های داخلی انگلستان مجموعه‌ای از درگیری‌های نظامی و سیاسی‌ای بود که در فاصلهٔ سال‌های ۱۶۴۲ تا ۱۶۵۱ بین پارلمان‌گراها که راندهد نامیده می‌شدند و سلطنت‌طلبان حامی چارلز اول، پادشاه وقت انگلستان، اسکاتلند و ایرلند که با عنوان کاوالیر شناخته می‌شدند اتفاق افتاد.,در فرانسه جنگهای داخلی بین حامیان پارلمان و سلطنت چارلز اول رخ داد.,c
جمهوری غَنا کشوری در غرب قاره آفریقا است که غنا در عهد استعمار به ساحل طلایی مشهور بود.,ساحل طلایی نام قبلی غنا است.,e
پیامبر اکرم فرمودند: منفورترین چیزهای حلال در پیش خدا طلاق و محبوبترین چیز حلال ازدواج است. ,طلاق امر حلال ولی منفور الهی است,e
اصل چهل و یکم: تابعیت کشور ایران حق مسلم هر فرد ایرانی است و دولت نمی‌تواند از هیچ ایرانی سلب تابعیت کند، مگر به درخواست خود او یا در صورتی که به تابعیت کشور دیگری درآید.,تابعیت ایرانی برای ایرانیان سلب نمی شود مگر به درخواست خود فرد.,e
بمباران شیمیایی شهر مرزی سردشت و حلبچه توسط هواپیماهای عراق، فجیع‌ترین و وحشتناک‌ترین تهاجم شیمیایی بود که آثار و پیامدهای منفی زیادی به بار آورد و همه جهان را تحت تاثیر قرار داد.,فاجعه‌آمیز‌ترین حملات شیمیایی عراق که همه جهانیان را تحت تاثیر قرار داد، حمله شیمیایی هواپیماهای عراقی به شهر حلبچه و سردشت ایران بود,e
ویژگی های هنر عصر اموی: ۱- تلفیقی بودن ۲- بازنمایی نوعی تفنن و تفریح ۳- نقاشی های تزئینی و تندیس های بی کیفیت,نقاشی های تزئینی و تندیس های بی‌کیفیت، یکی از ویژگی های هنر عصر اموی است.,e
نامه معروف و تاریخی امام خمینی (ره) خطاب به گورباچف آخرین رئیس جمهور شوروی توسط هیئتی عالی رتبه که در رأس آن، یک عالم دینی آگاه به مسائل سیاسی و مذهبی یعنی آیت الله جوادی آملی قرار داشت، به گورباچف ابلاغ و برای وی تبیین و تشریح گردید. ,آیت الله جوادی آملی مسئول رساندن نامه امام خمینی به گورباچف بود.,e
بر اساس اصل ۱۷۵ قانون اساسی ایران، رئیس صدا و سیمای ایران مستقیماً توسط رهبر جمهوری اسلامی منصوب می‌شود.,انتصاب ریاست صدا و سیما از وظایف قانونی مقام رهبری است.,e
رژیم عراق در پی عدم موفقیت در جنگ با ایران، دچار مشکلات زیادی شده بود. اروندرود بخش عمده تجارت دریایی عراق از آن راه صورت می‌گرفت. تا حصول نتیجه مذاکرات با ایران و لایروبی و پاکسازی آن، غیرقابل استفاده بود. لذا تنها به منظور کسب فضای حیاتی و راهیابی به دریا خواستار در اختیار گرفتن دو جزیره کویت به صورت اجاره بود که کویت با این امر مخالفت کرد.,صدام حسین پس از جنگ با ایران برای دستیابی به فضای حیاتی، خواستار در اختیار گرفتن دو جزیره کویت بود,e
دوره صفویان همزمان با دوره رنسانس در اروپا بود و دوره قاجاریه مصادف با دوره شکوفایی رنسانس بود.,دوره رنسانس در اروپا با دوره صفویان هم عصر بود.,e
هدایت تَکْوینی نوعی از هدایت که در خلقت و فطرت موجودات وجود دارد و همه از آن بهره دارند. این هدایت غیراختیاری بوده و همه را به سوی تکامل می‌برد. هدایت تکوینی را خدا با آفرینش و خلق موجودات و خصوصیاتی که در خلقت آنها قرار داده انجام می‌دهد.,هدایت تمامی موجودات هستی به سوی کمالات و اهداف مطلوبشان از طریق خلق و ایجاد قوا در درون هستی‌شان تکوینی نام دارد.,e
عوامل شیمیایی به گروه هایی از ترکیبات مواد سمی و کشنده اطلاق می‌گردد که بصورت جامد، مایع یا گاز (بخار)مورد استفاده قرار می گیرد و منجر به بروز اثرات مخرب کشنده یا مصدومیت شدید در انسان ها و جانوران و همچنین باعث تخریب محیط زیست و نابودی گیاهان می شود . این عوامل عبارت انداز: ۱. عامل سیانور: تنها عاملی که از طریق تنفس و جذب خون اثر سمی آن ظاهر می شود. ۲.عوامل عصبی ...,اثر سمی سیانور از طریق تنفس و جذب خون ظاهر می‌شود.,e
پیمان حلف الفضول پس از جنگ های فجار و در بیست سالگی عمر رسول خدا و با حضور ایشان در خانه عبدالله بن جدعان انجام پذیرفت.,پیامبر (ص) در سن بیست سالگی در پیمان حلف الفضول شرکت جست.,e
رابیندرانات تاگور به دو زبان هندی و بنگالی شعر می‌سرود و اشعار خود را به انگلیسی نیز ترجمه می‌کرد. هم سرود ملی هند و هم سرود ملی بنگلادش از تصنیف‌های تاگور است.,سرود ملی هند از سروده های رابیندرانات تاگور است.,e
"""هریت بیچر استو"" از نامی‌ترین نویسندگان ادبیات پایداری سیاهان و از هواداران فعال لغو بردگی در ایالات متحده آمریکا به‌شمار می‌رود.او با نوشتن کتاب ""کلبه عمو تام"" باعث شد آبراهام لینکلن دربارهٔ او بگوید: این زن کوچک جنگی بزرگ را آغاز کرد.","نویسنده کتاب ""کلبه عمو تام""، ""هریت بیچر استو"" است.",e
پس از آن که قرآن به سى جزء تقسیم شد، براى آن که قرآن‌آموزان بهتر بتوانند آن را فرا بگیرند، هر جزء قرآن را به چهار حزب تقسیم کردند. در این صورت قرآن ۱۲۰ حزب خواهد داشت.,قرآن کریم مجموعاً شامل ۳۰ جزء و ۱۲۰ حزب است.,e
شورای‏ بازنگری‏ قانون‏ اساسی‏ به ریاست رئیس جمهور با ترکیب اعضای شورای‏ نگهبان‏، رؤسای‏ قوای‏ سه‏ گانه‏، سه‏ تن از قوه‏ قضائیه‏، ده‏ تن به‏ انتخاب‏ مقام‏ رهبری‏، سه‏ تن از دانشگاهیان‏ و غیره تشکیل می‌شود.,ریاست شورای بازنگری قانون اساسی بر عهده رئیس جمهور است.,e
بر اثر تبلیغات سودربلوم، اسقف اوپسالا، نهضتی جهانی به وجود آمد؛ هدف این نهضت نه تنها متحد ساختن تمام پروتستان‌ها بلکه به هم پیوستن کاتولیک‌های قدیم نیز بود. ,از زمان اصلاحات پروتستان، کلیسای جامع اوپسالا توسط کلیسای لوتری سوئد کنترل شده است.,n
کاسیان‌ بر بابل‌ حکومت‌ می‌راندند، که‌ سلسله‌ جدیدی‌ در ایلام به‌ دست‌ ایگه‌-هالکی‌ بنیان‌گذاشته‌ شد. دوره‌ طلایی‌ ایلامی‌ها در زمان این سلسله بود و تاریخ کلاسیک ایلام، با تاسیس این سلسله رقم خورد که‌ کاملا از زیر نفوذ بابل‌ بیرون‌ رفتند و هنرایلامی‌ در همه‌ عرصه‌ها، به‌ اوج‌ شکوفایی‌ خود رسید.,دوره ی کلاسیک ایلام با تاسیس حکومت شوتروکیان جای خود را به تاریخ ایلام نو داد. ,n
دیوان عالی ایالات متحده آمریکا عالی‌ترین نهاد قضایی در ایالات متحده آمریکا و مرجع تفسیر قانون اساسی ایالات متحده آمریکا است.,دیوان عالی ایالات متحده آمریکا متشکل از ۹ قاضی می باشد.,n
ماده نوزدهم اعلامیه جهانی حقوق بشر: هر کس حق آزادی عقیده و بیان دارد و حق مزبور شامل آن است که از داشتن عقاید خود بیم و اضطرابی نداشته باشد و در کسب اطلاعات و افکار و در اخذ و انتشار آن با تمام وسایل ممکن و بدون ملاحظات مرزی، آزاد باشد. ماده سوم : هرکس حق زندگی، آزادی وامنیت شخصی دارد. ,ماده نهم اعلامیه جهانی حقوق بشر: هیچ کس نمیتواند خود سرانه توقیف، حبس یا تبعید شود. ,n
 بر اساس تاکتیک برچسب زدن از جنگ نرم، رسانه ها، واژه های مختلف را به صفات مثبت و منفی تبدیل کرده و آنها را به آحاد یا نهادهای مختلف نسبت می دهند.,کلمات منفی، نیروی منفی به سمت مخاطب می فرستند و حتی می توانند او را به سمت بیماری سوق دهند. ,n
پیغمبر (ص) فرموده اند: عقل، رسول باطنی و پیامبر، رسول ظاهری و بیرونی است.,رسول باطنی (عقل) برتر از رسول ظاهری است.,n
توحید نظری از نوع شناختن و توحید عملی از نوع «بودن» و «شدن» است. توحید نظری «دیدن» و توحید عملی «رفتن» است.,توحید عملی ناظر به وظایف عملی انسان در برابر خدا است که شامل توحید عبادی، اطاعتی و غیره است.,n
اُلیگارشی اصطلاحی است که اشاره‌های تحقیرآمیزی دارد؛ معنی آن این است که نه‌تنها حکومت در دست یک گروه کوچک است، بلکه این گروهِ حکمران و کوچک، فاسد است و در برابر تودهٔ مردم مسئول نیست؛ یا از جهات دیگر مورد بیزاری همگان است.,اُلیگارشی ممکن است به حاکمیت عده‌ای اندک نه‌تنها در زمینه‌ی حکومت کشور، بلکه به حکومت عده‌ای هم‌مسلک اشاره داشته باشد. ,n
رشید هجری از اصحاب خاص علی بن ابی‌طالب (ع) و محرم اسرار و یار شجاع و با وفای آن حضرت بود.,رشید هجری، علم منایا و بلایا را نزد امام علی آموخت.,n
از میان برهان های اثبات خدا، برهان نظم در میان متکلمان مسلمان رواج بیشتری داشته‌ و مفسرین بسیاری از آیات قرآن را بیان‌کننده این برهان می‌دانند.,ویلیام پیلی در کتاب «الهیات طبیعی» از برهان نظم دفاع می‌ کند.,n
از برکات و دستاوردهای مهم دفاع مقدس، تحکیم وحدت ملی بین آحاد ملت به ویژه گروه ها و احزاب سیاسی کشور بود؛ به طوری که همگی مزایای حزبی و صنفی خود را در خدمت مصالح نظام و امنیت کشور قرار داده بودند. ,آن چه که توانست به انقلاب اسلامی ما مصونیت لازم را ببخشد، برکات و اثرات مثبت جنگ تحمیلی بود,n
شعر نو فارسی با وانهادن قالب‌های شعر کلاسیک در قرن ۱۴هجری بوجود آمد. این‌گونه از شعر فارسی آزادی بسیاری را در فرم و محتوا به شاعر می‌دهد. نیما یوشیج را پدیدآورنده این نوع شعر در ادبیات فارسی و ملقب به پدر شعر نو فارسی می‌دانند.,افسانه اثر نیما را سر آغاز شعر نو می دانند.,n
از رویدادهای عصر شاه طهماسب آمدن آنتونی جنکینسون تاجر انگلیسی از جانب الیزابت اول از راه روسیه به قزوین و ملاقات او با شاه طهماسب در بیستم نوامبر ۱۵۶۲ و دادن نامه و هدایای پادشاه انگلستان است. جنکینسون که نخستین فرستاده یک پادشاه انگلستان به ایران بود قبلا چهاربار به روسیه سفر کرده بود.,جنکینسون نوشته است که هدف ماموریت گرفتن اجازه رفت و آمد و اقامت برای انگلیسی ها بود.,n
کمیسیون‌های مجلس شورای اسلامی، گروه‌هایی از نمایندگان مجلس هستند که با هدف بررسی تخصصی طرح‌ها و لوایح مطرح شده در مجلس تشکیل می‌شوند.,تعداد کمیسیون‌ها در آیین‌نامه داخلی مجلس مشخص خواهد شد.,n
بر اساس اصل ۱۴۲ قانون اساسی، دارایی‏ رهبر، رئیس‏‌جمهور، معاونان‏ رئیس‏‌جمهور، وزیران‏ و همسر و فرزندان‏ آنان‏ قبل‏ و بعد از خدمت‏، توسط رئیس‏ قوه‏ قضائیه‏ رسیدگی‏ می‌شود که‏ بر خلاف‏ حق‏، افزایش‏ نیافته‏ باشد.,با اعلام محرمانه بودن اموال مسئولان از سوی مجمع تشخیص مصلحت نظام، به نظر می رسد قانون رسیدگی به دارایی مقامات دارای نقاط ضعفی است.,n
زبان فارسی، در درازای تاریخ و در پهنه‌های گوناگون جغرافیایی، نام‌های گوناگونی داشته و دارد. این زبان به‌صورت رسمی در ایران به نام «پارسی» و «فارسی»، در افغانستان به نام دری، در تاجیکستان به نام تاجیکی، و در ازبکستان به نام «فارسی» مشهور است., زبان فارسی در بحرین «عجمی» نام دارد.,n
